Orbiter,OV_Designation,Total_Flights,First_Flight,Last_Flight,First_STS,Last_STS,Fate
Columbia,OV-102,28,1981-04-12,2003-01-16,STS-1,STS-107,"Destroyed during reentry on 2003-02-01; foam strike damaged wing leading edge RCC panels during launch"
Challenger,OV-099,10,1983-04-04,1986-01-28,STS-6,STS-51-L,"Destroyed 73 seconds after launch on 1986-01-28; O-ring failure in right SRB joint"
Discovery,OV-103,39,1984-08-30,2011-02-24,STS-41-D,STS-133,"Retired to Smithsonian National Air and Space Museum (Steven F. Udvar-Hazy Center)"
Atlantis,OV-104,33,1985-10-03,2011-07-08,STS-51-J,STS-135,"Retired to Kennedy Space Center Visitor Complex"
Endeavour,OV-105,25,1992-05-07,2011-05-16,STS-49,STS-134,"Retired to California Science Center (Los Angeles); built as Challenger replacement"
